{
  "schema_version": 1,
  "scene_id": "stage1-player-valid-v1",
  "characters": {
    "lira": "Lira"
  },
  "dialogue": [
    {
      "type": "scene",
      "target": "bg_tavern_interior"
    },
    {
      "type": "line",
      "speaker": "lira",
      "text": "Stage1 player valid line.",
      "metadata": {
        "test_probe": "stage1_player_valid_line"
      }
    }
  ]
}
